{
  "schema_version": "virtengine.task-88a.migration-inventory/v1",
  "task": "88A",
  "status": "dependency_blocked",
  "baseline_commit": "79391a3df86d85522b92e0400c6904971ecbe65d",
  "migrations": [
    {
      "id": "v1.5.0-provider-3-4",
      "task": "84B",
      "upgrade": "v1.5.0",
      "module": "provider",
      "from_version": 3,
      "to_version": 4,
      "execution_kind": "registered_module_migration",
      "store_impacts": ["provider signing-key epoch state"],
      "prefix_impacts": [],
      "protobuf_changes": [],
      "params_changes": [],
      "index_changes": [],
      "genesis_changes": [],
      "evidence": ["tests/upgrade/test-cases.json", "upgrades/software/v1.5.0/upgrade.go", "x/provider/module.go"]
    },
    {
      "id": "v1.5.0-settlement-1-2",
      "task": "84B",
      "upgrade": "v1.5.0",
      "module": "settlement",
      "from_version": 1,
      "to_version": 2,
      "execution_kind": "registered_module_migration",
      "store_impacts": ["settlement usage authentication state"],
      "prefix_impacts": [],
      "protobuf_changes": [],
      "params_changes": [],
      "index_changes": [],
      "genesis_changes": [],
      "evidence": ["tests/upgrade/test-cases.json", "upgrades/software/v1.5.0/upgrade.go", "x/settlement/module.go"]
    },
    {
      "id": "v1.6.0-hpc-1-2",
      "task": "84C",
      "upgrade": "v1.6.0",
      "module": "hpc",
      "from_version": 1,
      "to_version": 2,
      "execution_kind": "registered_module_migration",
      "store_impacts": ["HPC reservation links"],
      "prefix_impacts": [],
      "protobuf_changes": [],
      "params_changes": [],
      "index_changes": [],
      "genesis_changes": [],
      "evidence": ["tests/upgrade/test-cases.json", "upgrades/software/v1.6.0/upgrade.go", "x/hpc/module.go"]
    },
    {
      "id": "v1.6.0-market-7-8",
      "task": "84C",
      "upgrade": "v1.6.0",
      "module": "market",
      "from_version": 7,
      "to_version": 8,
      "execution_kind": "registered_module_migration",
      "store_impacts": ["market reservation links"],
      "prefix_impacts": [],
      "protobuf_changes": [],
      "params_changes": [],
      "index_changes": [],
      "genesis_changes": [],
      "evidence": ["tests/upgrade/test-cases.json", "upgrades/software/v1.6.0/upgrade.go", "x/market/module.go"]
    },
    {
      "id": "v1.6.0-mktplace-1-2",
      "task": "84C",
      "upgrade": "v1.6.0",
      "module": "mktplace",
      "from_version": 1,
      "to_version": 2,
      "execution_kind": "registered_module_migration",
      "store_impacts": ["marketplace canonical lifecycle activation state"],
      "prefix_impacts": [],
      "protobuf_changes": [],
      "params_changes": [],
      "index_changes": [],
      "genesis_changes": [],
      "evidence": ["tests/upgrade/test-cases.json", "upgrades/software/v1.6.0/upgrade.go", "x/marketplace/module.go"]
    },
    {
      "id": "v1.6.0-resources-1-2",
      "task": "84C",
      "upgrade": "v1.6.0",
      "module": "resources",
      "from_version": 1,
      "to_version": 2,
      "execution_kind": "registered_module_migration",
      "store_impacts": ["resource reservations and quarantine state"],
      "prefix_impacts": [],
      "protobuf_changes": [],
      "params_changes": [],
      "index_changes": [],
      "genesis_changes": [],
      "evidence": ["tests/upgrade/test-cases.json", "upgrades/software/v1.6.0/upgrade.go", "x/resources/module.go"]
    },
    {
      "id": "v1.7.0-escrow-3-4",
      "task": "84D",
      "upgrade": "v1.7.0",
      "module": "escrow",
      "from_version": 3,
      "to_version": 4,
      "execution_kind": "registered_module_migration",
      "store_impacts": [],
      "prefix_impacts": [],
      "protobuf_changes": [],
      "params_changes": [],
      "index_changes": [],
      "genesis_changes": [],
      "evidence": ["tests/upgrade/test-cases.json", "upgrades/software/v1.7.0/upgrade.go", "x/escrow/module.go"]
    },
    {
      "id": "v1.7.0-fraud-1-2",
      "task": "84D",
      "upgrade": "v1.7.0",
      "module": "fraud",
      "from_version": 1,
      "to_version": 2,
      "execution_kind": "registered_module_migration",
      "store_impacts": [],
      "prefix_impacts": [],
      "protobuf_changes": [],
      "params_changes": [],
      "index_changes": [],
      "genesis_changes": [],
      "evidence": ["tests/upgrade/test-cases.json", "upgrades/software/v1.7.0/upgrade.go", "x/fraud/module.go"]
    },
    {
      "id": "v1.7.0-hpc-2-3",
      "task": "84D",
      "upgrade": "v1.7.0",
      "module": "hpc",
      "from_version": 2,
      "to_version": 3,
      "execution_kind": "registered_module_migration",
      "store_impacts": [],
      "prefix_impacts": [],
      "protobuf_changes": [],
      "params_changes": [],
      "index_changes": [],
      "genesis_changes": [],
      "evidence": ["tests/upgrade/test-cases.json", "upgrades/software/v1.7.0/upgrade.go", "x/hpc/module.go"]
    },
    {
      "id": "v1.7.0-resources-2-3",
      "task": "84D",
      "upgrade": "v1.7.0",
      "module": "resources",
      "from_version": 2,
      "to_version": 3,
      "execution_kind": "registered_module_migration",
      "store_impacts": [],
      "prefix_impacts": [],
      "protobuf_changes": [],
      "params_changes": [],
      "index_changes": [],
      "genesis_changes": [],
      "evidence": ["tests/upgrade/test-cases.json", "upgrades/software/v1.7.0/upgrade.go", "x/resources/module.go"]
    },
    {
      "id": "v1.7.0-review-1-2",
      "task": "84D",
      "upgrade": "v1.7.0",
      "module": "review",
      "from_version": 1,
      "to_version": 2,
      "execution_kind": "registered_module_migration",
      "store_impacts": [],
      "prefix_impacts": [],
      "protobuf_changes": [],
      "params_changes": [],
      "index_changes": [],
      "genesis_changes": [],
      "evidence": ["tests/upgrade/test-cases.json", "upgrades/software/v1.7.0/upgrade.go", "x/review/module.go"]
    },
    {
      "id": "v1.7.0-settlement-2-3",
      "task": "84D",
      "upgrade": "v1.7.0",
      "module": "settlement",
      "from_version": 2,
      "to_version": 3,
      "execution_kind": "registered_module_migration",
      "store_impacts": ["settlement financial case state"],
      "prefix_impacts": [],
      "protobuf_changes": [],
      "params_changes": [],
      "index_changes": ["settlement financial case indexes"],
      "genesis_changes": [],
      "evidence": ["tests/upgrade/test-cases.json", "upgrades/software/v1.7.0/upgrade.go", "x/settlement/module.go"]
    },
    {
      "id": "v1.8.0-settlement-3-4",
      "task": "85B",
      "upgrade": "v1.8.0",
      "module": "settlement",
      "from_version": 3,
      "to_version": 4,
      "execution_kind": "registered_module_migration",
      "store_impacts": ["settlement fiat conversion state"],
      "prefix_impacts": [],
      "protobuf_changes": [],
      "params_changes": ["fiat conversion enablement and DEX/payout profile parameters default to external-blocked"],
      "index_changes": [],
      "genesis_changes": [],
      "evidence": ["tests/upgrade/test-cases.json", "upgrades/software/v1.8.0/upgrade.go", "x/settlement/module.go"]
    }
  ],
  "producers": [
    {
      "thread": "T1",
      "branch": "ve/prototype-t1-identity",
      "handoff_path": "_docs/ralph/handoffs/prototype-t1/HANDOFF.yaml",
      "status": "accepted",
      "sha": "36a566a92c04d988255b10cc5a75451d59077273",
      "migrations": [],
      "blockers": []
    },
    {
      "thread": "T2",
      "branch": "ve/prototype-t2-product",
      "handoff_path": "_docs/ralph/handoffs/prototype-t2/HANDOFF.yaml",
      "status": "accepted",
      "sha": "ba9f49340bbd8136f8c19bcc0abc7c64831bfda8",
      "migrations": [],
      "blockers": []
    },
    {
      "thread": "T3",
      "branch": "ve/prototype-t3-reliability",
      "handoff_path": "_docs/ralph/handoffs/prototype-t3/HANDOFF.yaml",
      "status": "accepted",
      "sha": "117ad92be90cc8a6a733ff701f1bc83fbbaf6790",
      "migrations": [],
      "blockers": []
    },
    {
      "thread": "T5",
      "branch": "ve/prototype-t5-platform",
      "handoff_path": "_docs/ralph/handoffs/prototype-t5/HANDOFF.yaml",
      "status": "accepted",
      "sha": "4efd873a4446c304f3ba5f25ec83d6f4185a0a3d",
      "migrations": [],
      "blockers": ["T5 VEID evidence and FundAuthorization precursor contracts are accepted, but persisted-store activation and app upgrade registration remain integration-owned work."]
    }
  ],
  "blockers": [
    "T5 persisted-store activation and app upgrade registration remain required before Task 88A can be complete."
  ]
}